placeId,title,tags,description
0,Meliá Athens,lodging|restaurant|food|point_of_interest|establishment,Meliá Athens facilities cover all our guests’ needs from dining experiences to wellness treatments. Savour traditional Greek flavours mingled with Mediterranean tastes to create ‘Balance’ in our hotel restaurants. All the 136 newly refurbished rooms are well appointed and offer a symphony of elegant furnishings and state-of-the-art technology. Refresh yourself and wash away your stress in the privacy of your spa-bathtub or de-stress in the hotel sauna and hamam. Stay fit in our modern and fully equipped Health Club. During the warmest months of the year enjoy the sunshine from the highest floor and take in the stunning views of the Acropolis while sipping your favorite drink prepared by our cocktail team.
1,POSEIDON ATHENS HOTEL,lodging|restaurant|food|point_of_interest|establishment,Poseidon Athens Hotel provides the ultimate destination for holidays in the Greek capital. Away from the hustle and bustle of the city center and with incomparable connectivity to all the major sights and attractions in Athens our hotel boasts a privileged location and can serve the needs of families couples and parties of friends adventurers and business people from all over the world. Even on a tight schedule you may explore Athens to the fullest with the help of the specific location of Poseidon Athens Hotel and thanks to the superb access to all means of transportation. Just a breath away there is the Tram and a bus station for you to hop on and start discovering the hidden gems of Athens.
2,Radisson Blu Park Hotel Athens,lodging|bar|restaurant|food|gym|health|point_of_interest|establishment, The Radisson Blu Park Hotel Athens places you right in the center of Athens. Our conveniently located Athens hotel sits at the edge of Pedion tou Areos one of the city's largest parks and is only a short stroll from the National Archeological Museum. Discover the city's vibrant atmosphere and immense history right on your doorstep. Enjoy comfortable and contemporary style in all 160 rooms and suites at our Athens hotel where free high-speed Wi-Fi marble bathrooms and individual climate control come as standard. Maintain your fitness routine or relax after a busy day at our in-house fitness center complete with sauna and steam room. Bask in the sunshine—with fabulous views of the city and its many architectural gems—by our stunning rooftop pool.
3,The Athenian Callirhoe Exclusive Hotel,cafe|lodging|bar|restaurant|food|point_of_interest|establishment, A unique 4 star superior Boutique Hotel in the heart of Athens City where style and comfort are happily coupled to offer a pleasant stay with the finest accommodation and delightful culinary experiences. At Athenian Callirhoe hotel one of the most well-known hotels in Athens you will discover a distinctive building with elegant urban interior design enjoy the very best in luxury and service while being spoiled with the 'little things' a guest needs to make one feel at home. Visit our roof garden restaurant “Callirhoe VIP” to savour refreshing cocktails and delicious cuisine creations enjoying the breathtaking view of both Acropolis and Lycabettus hill.
4,Athens Atrium Hotel,lodging|restaurant|food|point_of_interest|establishment, Known for its comfort personal service and classic elegance Athens Atrium Hotel & Jacuzzi Suites is one of the most promising 4 star hotels in Athens. Athens Atrium Hotel & Jacuzzi Suites offers both affordable luxury and convenience from its quiet location only minutes away from the heart of Athens busy city centre. Athens Atrium Hotel & Jacuzzi Suites features 56 spacious guest rooms and bathrooms that combine warmth style elegance and the latest technology. These details transform Athens Atrium into an ideal place; both for leisure and business travellers.
5,NJV Athens Plaza,cafe|lodging|bar|restaurant|food|point_of_interest|establishment, As one of the top luxury hotels in Athens our property features 162 guest rooms and 18 elegant suites that are tastefully decorated with modern touches and include first-class amenities. The NJV Athens Plaza Hotel aims to satisfy every guest including our guests traveling on business. Our meeting and event facilities are spacious and can hold up to 350 people while our state-of-the-art equipment allows for a successful conference special event board meeting or business luncheon.At the NJV Athens Plaza you can expect nothing but the best. Visit us and “Live the absolute experience for absolute moments!”
6,Savoy Hotel,lodging|bar|restaurant|food|point_of_interest|establishment, This unpretentious hotel is 2 km from the Port of Piraeus a 3-minute walk from the Archaeological Museum of Piraeus and 1 km from the Maritime Museum of Greece.The simple rooms have traditional décor free Wi-Fi flat-screen TVs and minibars and some have balconies. Suites have extra spa baths with tea and coffee making facilities. Room service is available.Free amenities include parking and a buffet breakfast. There is also a lobby bar and a quaint restaurant as well as a meeting room.
7,21 Restaurant,restaurant|lodging|food|point_of_interest|establishment, Situated on the ground floor of TWENTYONE hotel with a separate entrance 21 is a bar-restaurant that has become quite a hit with the hip crowd while still tapping to the sophisticated gourmets. The menu sets the mood for international cuisine touched with a flavor of Italian and Greek. Delicious cocktails served at the bar make a big splash.Guests can enjoy breakfast and dinner indoors or outdoors in the summer months.
8,FAROS HOTEL ΠΑΜΠΟΡΗΣ ΧΡΗΣΤΟΣ & ΣΙΑ Ε.Ε,lodging|restaurant|food|point_of_interest|establishment, The rooms have air conditioning and a bathroom. The rooms have a double bed for a good night's sleep. In addition there is a minibar. Great holiday comfort offers internet access a telephone and WiFi. There is a shower inside the bathrooms.The hotel has 44 rooms. The individual floors are easily accessible by elevator or by stairs. The equipment includes a luggage storage a cafeteria a bar and a room service. The wireless local area network in the common areas enables the customers to communicate with their own.
9,Στυλ,cafe|restaurant|food|point_of_interest|store|establishment, 
10,Οινοσχολείο - Μουσικό Μεζεδοπωλείο - Ζωντανή Μουσική,restaurant|food|point_of_interest|establishment, THE MOST FUN MUSIC TAVERN SHOP! NEVER THE ENTERTAINMENT WAS SO SUFFICIENT! Its name is not accidental. Years ago it was a school. It is a 100-year-old stone building that has been operating for the last 20 years. "It exudes warmth and is addressed to people with passion and opinion. The music is live and you will listen to old and new folk songs with the result that in the early morning hours the WINE SCHOOL is transformed into a school of dance fun and entertainment.
11,Eridanus Hotel,restaurant|food|point_of_interest|establishment,Offering a free private carpark a steam room and a sun terrace Athenaeum Eridanus Luxury Hotel is set 650 metres from Psyri. Set within a few minutes' drive from Alsos it is an unique accommodation to stay in Kerameikos district of the city.The venue is situated 1 km from Athens city centre and 40 km from Eleftherios Venizelos airport. Guests will be 15 minutes' walk from Parthenon. Staying at this hotel you'll be near Bouleterion and Museum of Illusions Athens.A number of elegant rooms with a stunning view are also available.A buffet breakfast is served at the bar. On site guests will find a Michelin-starred restaurant that offers specialities of Greek cuisine. The café bar prepares a wide variety of tea and coffee. Middle Eastern Mediterranean Greek and Deli delights can be enjoyed at Ta Karamanlidika tou Fani located in the area. In order to save some money you can use public transport — Thiseio tube station can be found 400 metres away. A satellite LCD TV and a garden are provided for your leisure time. Alternatively guests can exercise in a gym facility.
12,Cafe Boheme,restaurant|cafe|food|point_of_interest|establishment, Bistro style restaurant/bar serving food that embodies the best of the Mediterranean. and beyond! A selection of fine Greek wines are available to accompany your food. The cozy and relaxed atmosphere make Boheme ideal for every rendezvous throughout the day or night. A favorite with the locals it has a rocking bar great for afterwork drinks and in the evenings the best DJ's in town set the mood
13,ΕΣΤΙΑΤΟΡΙΟ ΔΑΦΝΕΣ,restaurant|food|point_of_interest|establishment , Daphne's is a classic in every sense of the word located in Plaka and the preferred destination of visiting public figures from the international political scene and business world. Major tourist agencies throughout the world regularly recommend Daphne's as one of the top choices for Greek gourmet cuisine. Daphne's has had truly select customers over the years and has been chosen to host meals for political leaders such as Bill and Hilary Clinton. The cuisine has a Mediterranean accent with a touch of creativity: classic starters as well as meat and fish dishes with a nouvelle touch resulting in a truly impressive gastronomical experience
14,Τα Πέντε Πιάτα,restaurant|food|point_of_interest|establishment, restaurant|food|point_of_interest|establishment
15,El Convento,restaurant|food|point_of_interest|establishment, The restaurant El Convento Del Arte in Metaxourgeio is a special place with Mediterranean cuisine. It is a hangout for artists and people who love art and good food. At El Convento Del Arte enjoy unique evenings of taste and entertainment with theatrical or live music acrobatics and other events that accompany your food or drink. Bright red classic furniture chandeliers and atmospheric decoration reminiscent of Baroque create a space that looks like it came out of a movie. At El Convento Del Arte you will taste ravioli stuffed with beef tail risotto with a variety of forest mushrooms chicken breast cooked in a crust of prosciutto and aromatic pendants
16,BRASSERIE ΒΑΛΑΩΡΙΤΟΥ Α.Ε.,restaurant|food|point_of_interest|establishment, The Brasserie of Sofia Pouloudi in Valaoritou has been a "must" hangout in the city center since 1999 and a favorite meeting place for journalists  politicians  artists  lawyers  businessmen  bankers  but also everyday shoppers!The space is also available for special events  business dinners and festive parties.
17,Εστιατόριο Αθήρι,restaurant|food|point_of_interest|establishment, Athiri restaurant first opened in 2004 by chef Alexandros Kardasis in Korydallos while in october 2007 it moved to Kerameikos at the old neoclassical home on Plataion street with its full-of-green yard. The restaurant's philosophy is based on creativity which combines greek/Mediterranean tradition with modern progress and perspective
18,Piu Verde,cafe|bar|restaurant|food|point_of_interest|establishment, In the Papagos Grove only ten minutes from the center of Athens in an idyllic location full of pines artificial lake and running water that really makes you get away from everything you are used to so far. Here you can enjoy your coffee food and drink in the enchanting aura of the special landscape.
19,Ναυτικός Όμιλος Αλίμου,restaurant|food|point_of_interest|establishment,In the enchanting bay of Vouliagmeni  in the facilities of the Nautical Club of Vouliagmeni  operates the restaurant "Omilos" with stunning views  especially on nights with a full moon.
20,Eleas Gi,restaurant|food|point_of_interest|establishment, Through a delicious journey through time  the Greek land and the products it gives  the customs and habits  but also through modern interventions in the traditional cuisine  whose primary purpose is to refresh  emphasize and highlight even more the Delicious references to the deepest roots of the Greek culinary tradition  bring to your plate a special variety of excellent delicacies  with seasonal products only  a gastronomic trip to Greece where the flavors follow each other and make friends. of life.
21,tavern Jordan,restaurant|food|point_of_interest|establishment, The host was able to get a table for us quickly. That was very important as we had been traveling for nearly 20 hours. Live local music that still allowed for conversation.We had stuffed vine leaves outstanding and fried cheese with honey which was equally tasty and outstanding.Service was good and quick. No one rushed us and the trio who were the live band never took a break so the entertainment was more than my normal experience.Seemed to be a safe neighborhood as we walked back late.
22,V1935 Luxurious Apartments,cafe|lodging|restaurant|food|point_of_interest|establishment, Behind V 1935’s heavy iron door  the building's entrance is decorated with colorful orange  black and white marble tile  a reflection of its glorious past  with a reception in the lower level and a roof garden on the 6th floor where you can be served all day  from breakfast to late night drinks and tapas.
23,TGI Fridays,restaurant|food|point_of_interest|establishment,TGI Fridays is an American restaurant chain focusing on casual dining. The name is asserted to stand for "Thank God It's Friday" although as of 2010 some television commercials for the chain have also made use of the alternative phrase "Thank Goodness It's Friday."
24,Υάδες,cafe|restaurant|food|point_of_interest|establishment,Packed Food  Reservations  Outdoor Seating  Buffet  Seats  Parking Available  Privileged Parking  Wheelchair Accessible  Alcohol Serving  Accepts American Express  Accepts Mastercard  Visa Accepts  Digital Payments  Free Cash  Free WiFi
25,Only1 Cafe,cafe|meal_delivery|meal_takeaway|restaurant|food|point_of_interest|store|establishment,Great atmosphere  reasonable prices and professional staff  all to guarantee your one hundred percent satisfaction. We are here for you  from morning to night  for breakfast  for business meetings  offering you soft drinks and snacks.
26,Σκόλιον - Skolion,restaurant|food|point_of_interest|establishment, The rebetika songs have their honor in Skolion  by Dino Konstantinidis and his musicians. As for the food  you will try rustic flavors and a variety of snacks. Moderate space  good food. Super music. Try not to go on Friday or Saturday night because it is a waste. Once we went Sunday and we were a few people we had a wonderful time.
27,Pizzeria Romas,restaurant|food|point_of_interest|establishment,Pizzeria Romas is a family business that with passion and love  offers you the best genuine Italian pizza in wood oven  that you have tasted! The process of creating our pizza is a ritual  starting from the creation of the dough  the maturation  the portioning  the opening of the dough in the hand  the secret recipe of the tomato sauce from fresh Greek tomatoes and Italian tomato  the fresh and always fresh our ingredients and of course culminates with the baking of pizza in our traditional wood oven We keep unchanged the recipe of the 17th century  when the creation of pizza first began in Italy  with the same traditional way of baking and making dough. Our wonderful place at 77 Nikolaou Dimitrakopoulou with the spectacular wood oven and the eclectic atmosphere is the best setting to complete your delicious journey in Italian cuisine  enjoying our delicious spaghetti from the top brands of the highest quality Italian sausages. and the rest of our dishes  all on time. Accompanying your dinner  we have an extensive list of the best Italian & Greek wines  as well as beers from around the world. You can enjoy all our products in your own space  as we offer you a free distribution service
28,Piggy - Πόπουλο,meal_takeaway|restaurant|food|point_of_interest|establishment, We started with a glass of iced Septem - just what we needed for the time being. We chose a portion of roasted mushrooms and  avoiding the wrapped ones -explained why-  we took a portion of pork chops and a portion of round  which is made in the store  for better quality control. Out of the list  we ordered the salad with avocado  tomato  pesto and manouri. The salad was fantastic and fortunately not at all "mommy". Ripe avocado  good tomato  delicious cheese  and all tied with basil sauce - excellent. The mushrooms were also good  juicy and delicious. The round was also very tasty  as spicy as it should be  to "extinguish" perfectly with the light tzatziki that accompanies it. We were somewhat disappointed with the steaks  which  despite the enhancement with salt and lemon  remained completely neutral. It may have happened. However  we really enjoyed the salty pies and the homemade french fries that accompany the meat.
29,Saloon Piano Restaurant,restaurant|food|point_of_interest|establishment, Saloon Piano Restaurant in Ilisia is one of the favorite hangouts of Athenians for international cuisine and live music (Piano - Jazz). It has been operating for over three decades  having hosted celebrities who enjoy quality food and impeccable service. The space is special and warm with the red color and the impressive piano dominating  creating an elegant and at the same time retro atmosphere. The menu of Saloon Piano Restaurant includes the most delicious specialties from around the world that will cater to the most demanding foodies. Try asparagus fillet  agar fillet  ou poavr Hadjidakis fillet  turkey but also fine meat from ram steak (sirloin without bones)  schnitzel and juicy burger  fresh seafood  soups and you can taste it in the summer. in the lovely garden of the restaurant.
30,Athens Bar Crawl,bar|restaurant|food|point_of_interest|establishment, Explore the authentic Athens‘ nightlife with our experienced tour guides. Meet travellers from all around the world  taste the Greek way of drinking while dancing the night away in the most popular (rooftop-) bars that the Greek capital has to offer! We take you to 3 bars  1 club. Free shots included in every location  as well as free entrance into the club.
31,nice n easy,cafe|bar|restaurant|food|point_of_interest|establishment, More than anything else  ‘nice n easy’ is a way of life. It’s about food  it’s about people and -maybe the most important of all- it’s about our approach to life itself. Loyal to our farm-to-table philosophy from day one  we obtain the finest organic ingredients  almost exclusively from Greek producers  offering you proudly and responsibly traditional recipes and new delicious suggestions that harmoniously balance the familiar and the modern.
32,Oinopoleion,restaurant|park|liquor_store|food|point_of_interest|store|establishment, Oinopoleion” means “Wine-Shop” in Greek! We are a Wine Restaurant/Tavern and we also keep a retail wine shop for buying wine to go. The wines we serve and sell are exclusively produced by our family owned award winning Winery “Markou Vineyards” located in the Attican wine country! Come and experience authentic old-school atmosphere  the most delicious Greek traditional dishes  live rebetiko music from some of the best Athenian underground musicians and internationally awarded amazing local wines
33,Το Κονάκι  Ταβέρνα,restaurant|food|point_of_interest|establishment, Konaki is a place that as its name suggests we want to become your hangout or your koutoukaki as some others say. So we created a beautiful place to offer wonderful traditional flavors good wine and a pleasant atmosphere to you your company and your family. We are waiting for you!
34,shopping house,shopping_mall|department_store|restaurant|food|point_of_interest|clothing_store|store|establishment,Shopping House started operating in 1999 and is the first department store that follows the logic "shops in a shop" in the southern suburbs.It quickly becomes the "meeting point" of the south  offering customers who visit it the enjoyment of a unique shopping experience.Having passed almost 20 years of successful course  Shopping House has been identified with the concept of Shopping!With 4 floors full of trends  6 500 sq.m. Full of friendly service  Shopping House covers over 45 complete stores and 300 branded brands of women  men and children  clothing and footwear  cosmetics  accessories  toys and household items.
35,beertime,bar|restaurant|food|point_of_interest|establishment, Beertime is a special brewery housed in a listed building in Psyrri. Careful space with details that you discover slowly  turning your gaze around. Special emphasis has been given to the quality of construction: the perfect combination of stone  wood and iron  the handmade furniture  the imposing chandelier with 300 bottles of beer  the cold room and the open kitchen. The atmosphere is hospitable  the environment is relaxed  the service is pleasant. Rock music and specifically from the 60's until today. For more atmospheric moments  choose the cellar with the wooden roof from 1870 and the stone walls  a warm and unique space overlooking the cold room  has its own draft beer taps  is autonomous and perfect equipped for events  exhibitions  parties  etc. What will definitely impress you is the fact that in its menu you will find all the beers of the Greek small breweries (it has exclusively the fresh beer Harma in a barrel from the Chania Brewery). It has a wide variety of lagers and weiss  the best choices from Bavarian breweries  as well as the most representative from countries such as Scotland  America  France  Belgium  the Netherlands  Ireland  Russia  Turkey and the United Kingdom. Its strong papers are the quality beers from all the monasteries in Germany. In the menu you will also find non alcoholic  gluten free and fruit beers  while next to each beer there is a short taste description as well as its ranking in the official menu of ratebeer
36,Archontiko,restaurant|food|point_of_interest|establishment, Greek traditional cuisine served in a cosy-interesting space at Marousi or delivered at your door at reasonable prices.
38,Θέατρο Τρένο Στο Ρουφ,cafe|bar|restaurant|food|point_of_interest|establishment, The "Wagon-Restaurant" is a restored pre-war dining car  which is now a restaurant. Guests can enjoy a delicious greek- mediterranean meal in the authentic  romantic atmosphere of a bygone era -in special evenings with live music. They can also visit the art installations  exhibitions and innovative artistic events being held here. - The Wagon Bar is an old wooden cargo  used to transport "eight horses and twenty men" during the Second World War. Nowadays it opens as a bar until late at night  with music  DJs  drinks and snacks. It also often hosts site-specific performances. In this atmospheric and cosy wagon guests can enjoy a drink  meet the artists from the various performances or can even hold a party
39,Jimmy's Coffee Shop,cafe|restaurant|food|point_of_interest|establishment, Since 1981 we have been building strong bonds with our customers and we continue to take care of their every pleasure.Our love for quality coffee and the high quality of services in restaurants created the need for us to offer the Athenian public a place where they can enjoy their coffee and food on the most famous pedestrian street in the city.
40,Μπακαράτ,bar|point_of_interest|establishment, Every return to Paris is a search for aromas  flavors and even textures that have engraved this  the most beautiful of cities  in my heart. I often find myself looking for the smells of urban bistro specialties. Those escargot bourguignon stuffed with a fragrant sauce with oil  garlic and parsley  duck orange and the simple but perfect steak frites  with the finely chopped crispy potatoes. I remember a pianist in Montmartre with a piano and a singer who  if you closed your eyes  thought you were listening to Edith Piaf. I have a sweet memory dressed in red from this store. And it had almost faded in my memory until the other day I found myself in a new restaurant in Metaxourgeio that reminded me a lot. On a street behind Avdi Square  a special corner of Athens  where cozy restaurants and bars with brothels and internet cafes with foreigners coexist. A beautiful neighborhood  which is now being formed by acquiring hangouts. So here I discovered a small restaurant with a bright red character  black touches and elements  such as chandeliers  gold frames  wallpapers and the bar  which give it a slightly "cabaret" character. A jazz trio accompanies a very good singer with swing  bossa nova and jazz rhythms
41,Κραντζ,bar|point_of_interest|establishment, Serving Alcohol  Free WiFi  Credit Cards Accepted  Dog Friendly Breakfast  Lunch  Dinner  Brunch  Drinks
42,FEVER G,night_club|bar|point_of_interest|establishment, FEVER opened its doors in 1999 as the largest space in Greece and since then is part of the constant choices of winter entertainment. For more than 10 years now are attributed to its collaborations with renowned artists with very large productions. FEVER is located on Syggrou and Lagoumitzi streets  extends to 2000 sq.m. in a comfortable and modern environment  with autonomous parking  specialized multi-member staff  rich international cuisine and 24-hour telephone customer service
43,Gazarte,movie_theater|tourist_attraction|book_store|bar|point_of_interest|store|establishment, With our team we share the same values the same ambitions and the same dreams. With a common vision consistency and dedication we all work to create a cultural center that allows artists to realize their vision and offers visitors a unique artistic program high quality services and unforgettable experiences.
