placeId,title,tags,description
44,Cabaret Voltaire,bar|point_of_interest|establishment, Cabaret Voltaire hosts the dance-theater performance "Bar" by Electra Arsenidou. This is a fresh sentence  which treats movement and speech as "intriguing" means of expression. It is a work full of upheavals  where the synergy of the simple weaving of events and the uninterrupted manifestation of emotions serves the realization of situations that we have all experienced or could face in such a place. Of course  in this show  everyday life meets the absurd and the bar is used as a stage space  hiding place  background and place of birth of events. A play studded with strong surreal elements  bittersweet humor and grotesque characters  which forces us to wear colored glasses for a while. After all  a bar is nothing more than a distorted rendition of morning reality. The role of the audience is also catalytic  as several times it defines the speed and style of the plot. We are all part of the game and the scene is everywhere. In conclusion  the "Bar" is characterized by a "discreet" interactive development  which as it unfolds reveals the loneliness  the unexpected and the farce of life. A show that is definitely worth seeing.
45,Ιπποπόταμος,bar|point_of_interest|establishment, Bubble: Happy rock bar! Perfect music choices by the DJ & friendly stuff! Vintage decoration  pop corn with your drink and delicious white sangria (5 €). Normal prices in general. Lovely!
46,ΑΓΚΥΡΑ Δ. Α. ΠΑΠΑΔΗΜΗΤΡΙΟΥ Α.Β.Ε.Ε.,night_club|bar|point_of_interest|establishment,
47,Big bar,bar|point_of_interest|establishment, Big bar since 2004 the 1st bear bar located in Votanikos Gazi area in Athens into drag scene without entry fee offer coffe and garden monthly themed parties   karaoke nights   bingo and drag shows   international music and guest DJ s   Bear parties
48,ΤΟ ΤΡΙΚΥΚΛΟ ΚΑΦΕ-ΜΕΖΕΔΟΠΩΛΕΙΟ-TO TRIKYKLO,cafe|bar|restaurant|food|point_of_interest|establishment, We wanted to make our passion our profession and shareit with everyone In this big town  in order to meet each other  we have to arrange it ahead of time. We wanted to change this by creating a hangout We wanted to bring people closer to taste  closer to music  closer to one another We put 3 wheels on our vehicle and started our journey in 1997. And we are still moving From the beginning our moto was : You eat what we eat  you drink what we drink It still is !
49,The Drugstore 1,bar|restaurant|food|point_of_interest|establishment, 
50,HOXTON,bar|cafe|food|point_of_interest|establishment 
51,RAKOMELO - ΤΟ ΡΑΚΟΜΕΛΟ,bar|cafe|food|point_of_interest|establishment,Rakomelo was born in Ilioupoli in a stone house of '29 in December 2006. Colorful and aromatic artistic hangout with a capacity of 50-60 people who loves traditional spirits fusion Greek cuisine based on rakomelo Greek and world quality music
52,Saint George Bar,bar|point_of_interest|establishment,In the beautiful square in Athens next to the church of Agios Georgios ... nice decoration awesome music. As long as the weather allows sit outside comfortably and enjoy your drink
53,Κρασοπενιές Summer - Μουσικό Μεζεδοπωλείο,bar|restaurant|food|point_of_interest|establishment,Gastronomic feast !! Greek cuisine appetizers dishes dishes carefully executed sweets for all tastes. If you still want to drink your drink and have fun you are also welcome.
54,Litharia,bar|restaurant|food|point_of_interest|establishment,An atmospheric Brewery that concentrates the charm of an old stone house of 1927. The stone the wood the earth tones warm the space and create a friendly elegant environment that inspires. bison ginger with Madagascar green pepper and delicious pork shank that melts in your mouth. Continue your delicious enjoyment with ostrich fillets grilled wild boar fillet with mushrooms and bacon or turkey steaks marinated in lemon oil. In summer tables come out in the green cool.
55,O&B Athens All Day Bar Restaurant,restaurant|cafe|bar|food|point_of_interest|store|establishment,In the heart of a city full of life in one of its most "interesting" neighborhoods the O&B Athens All Day Bar Restaurant invites and challenges the residents and visitors of Athens to taste its special flavors. The atmospheric lighting the refined decoration the special environment and the friendly service make the O&B a unique choice for your meal and drink. Separate dishes created with high quality ingredients paired with carefully selected wines and drinks. Greek traditional flavors are redefined in the light of modern cooking and are presented to friends of good food always with a high level
56,Kibubu Music Bar,bar|point_of_interest|establishment,From the moment you enter the entrance of Kibubu Music Bar one thing is necessary: ​​to leave your senses free and enjoy the music choices of the DJ the delicious cocktails of the bar and the hospitable service that will make you visit this unique place again and again.
57,EXCALIBUR BAR,bar|night_club|point_of_interest|establishment, Excalibur opened its gates in 2004  offering unique evenings full of music from the whole range of rock in a friendly space with a medieval atmosphere suitable for modern knights with an authentic rock view. With a daily program by a dj group but also surprises such as live  special nights  parties as well as the famous Sunday afternoons with a piglet in oil paste  the castle of rock music holds up well and is called Excalibur!
58,Elaea Mezedadiko,cafe|bar|restaurant|food|point_of_interest|store|establishment, Greek Traditional cuisine Located opposite the Acropolis Museum Packed Food  Reservations  Outdoor Seating  Buffet  Seats  Wheelchairs Available  Wheelchair Accessible  Full Bar  Wine & Beer  Mastercard Accepts  Visa Accepted  Free Wi-Fi  Free Wi-Fi
59,TALL'S TOY,bar|cafe|food|point_of_interest|establishment,The "tall" of Karytsi spreads his toys in one of the most historic galleries of the old commercial triangle creating one of the most cozy urban atmospheres of the center. Full of warmth well-made coffee hot chocolates and healing herbs.
60,BEER GARDEN RITTERBURG,bar|restaurant|food|point_of_interest|establishment,Stone and light wood in a classic style with some traditional touches but not a particularly heavy space that has been representing German (mainly Bavarian) cuisine in Athens for years turning here and there to Austria. Kasslerbraten pork schnitzel and not only come in large portions while there are also plates / varieties to accompany your beer.
61,EN FLYA,bar|cafe|food|point_of_interest|store|establishment,All day bar that in addition to coffee juices and drinks offers salads of all kinds (excluding those of fruit) and gourmet dishes with pure ingredients to accompany the beer or tsipouro. In general food pairing is sought after and very careful even for whiskey there is the appropriate meze in order to "tie" harmoniously with its taste. 
62,ROCKWOOD,bar|point_of_interest|establishment,A small treasure in the heart of Athens! A beautiful and cozy place a classic hangout of Athenians for eating coffee beer or a drink next to the Archaeological Museum and just 5 minutes from the Victoria power station
63,Silly Wizards Pub,bar|liquor_store|restaurant|food|point_of_interest|store|establishment,Silly Wizards is at the top of the pantheon of domestic pubs - not only because it was one of the first nor because its range will satisfy even the most demanding beer lover - but because it managed to create its own legend because people have fallen in love there because it has hosted subversively wedding tables (with guiness stew for mainly!) because it always stays up to date because it is timelessly cool. Because the hospitality here experiences an ideal version and because it promotes decompression relaxation breaks from everyday life and all kinds of friendly gatherings in one of the most intimate places in Athens. From the hottest
64,My Friends Cafe,cafe|bar|food|point_of_interest|store|establishment, My Friends Café is a family business and has been operating since 2010. It is an Espresso bar unique in its kind as it serves only the best Arabica coffees that are roasted by us every day. We import only ARABICA green coffee from all over the world and only Specialty varieties. The coffee is roasted daily in order to have the best quality and freshness for our customers. We do not use any preservatives or chemicals in the preparation or packaging of our coffee. Enjoy the best coffee at home. Ask us to grind the mixture of your choice !! My Friends Cafe is the perfect place to enjoy your morning coffee  watch the latest news or have a quick meal. Everyday life at My Friends Café is enjoyable and full of passion for coffee with friends  family and colleagues. My Friends Cafe also offers a variety of salads  baguettes  club sandwiches  sweets and much more. Relax with a newspaper or magazine and enjoy your gourmet coffee. 
65,GhostHouse,night_club|bar|point_of_interest|establishment, What your ears will hear and your eyes will see you will not find WHERE !!! Because it is fun  you have a good time with the spas and it will be unforgettable! Because it is the Mecca of Athenian karaoke where every night it turns into a varied live program with enthusiastic spectators and voices of all levels where you will experience surreal situations  you will enjoy rock bands  skylights  artful craft flags  but also an unbelievably unique stage presence! Because in the final it is the ABSOLUTE AKHTARMAS and by far the No1 karaoke of the city! The other side of the fun the Ghost Karaoke Show plays every Friday-Saturday & Sunday in the most cult scene of Athens the Ghost House and it is worth to see and experience it for one night!
66,A LIAR MAN,bar|point_of_interest|establishment, It is a beautiful shop  well hidden in the quiet alley  two steps from the metro station 'Kerameikos'. It is housed in an old Athenian house  which has been completely renovated keeping the old layout intact. The interior is amazingly decorated. Beautiful paintings and photos on the walls  colorful lighting and small decorations scattered in every corner. The floor is covered by a beautiful mosaic made of small pebbles  giving the feeling that you are on an island. The space is divided into three rooms  the negative is that the configuration does not serve much  as a result of which you are not allowed to move a chair and most of the time you are a little cramped. evening outings. 
67,Malvazia,restaurant|bar|food|point_of_interest|establishment, In the space  the impressions are stolen by the traditional architecture that unfolds the graces of the stone. As soon as it smells like summer  the glass roof opens and coordinates you with the starry Attic sky  the surrounding trees and the abundant plants. The relaxed and pleasant atmosphere is enhanced by the candles whose flame flickers  adding a romantic note. The menu takes you on the delicious paths of Greece. The fresh herbs and ingredients of the season are ideally combined  highlighting their virtues in every dish.
68,sempre coffee & cocktail bar,cafe|bar|food|point_of_interest|store|establishment, If you have wanted really good coffee made with taste then you just have to hurry to Semper. For ten years he has stood out for his willingness for constant renewal and of course for his coffee and his expertise in what makes him without exaggeration one of the best if not the best coffee in town. Always choosing our best coffee blends  they serve it at the right temperature to highlight all its aroma and taste.
69,Avant Garde,bar|restaurant|food|point_of_interest|establishment, The modern wine bar restaurant AVANT GARDE offers a complete gastronomic proposal with modern creative and pioneering cuisine from French influences and high quality raw materials. A place of unique aesthetics and minimal design where you can enjoy the gastronomic creations during the day and at night. It is worth noting that the AVANT GARDE transforms over time. You can enjoy a wonderful meal early in the afternoon and later have fun drinking your drink… So the visitor can choose between a delicious lunch or a full dinner curated by renowned chefs Paris Delidis (48 the restaurant) and Giannis Loutsis (Asteras Vouliagmenis). An all day spot suitable for business meetings and meals  fun side nights and romantic moments. 
70,Crescento Bar,bar|cafe|restaurant|food|point_of_interest|establishment, The cafe-bar Crescento is located at the intersection of Petraki 1 & Voulis 22 streets in the center of Athens  in Syntagma. We are waiting for you to enjoy your coffee or drink. 
71,MAUZAC,restaurant|cafe|bar|food|point_of_interest|establishment, The word that describes it is "loose". And comfortable. Simply elegant with pleasant music from the international scene and a wonderful garden where the "brave" can now enjoy their evening drink on the comfortable sofas.
72,The Wee Dram Scottish Pub,bar|restaurant|food|point_of_interest|establishment, It brings an atmosphere directly from Scotland while you are in Athens! Based on Scotland themed decor nice beers whiskey after a snack or a pizza! Screens on which you can enjoy football games especially those of the British and European leagues.
73,Tender Bar,bar|point_of_interest|establishment, Tender is the absolute after of B.P. The doors open at 11 and something in the room is dressed in low light and a neon sign begs "What happened last night?". From the smiling girls at the reception to the cheerful bartenders who juggle the bottles with mastery that David Copperfield would envy and the most beautiful faces of Athens to the unforgettable themed parties that have become an institution  Tender is exactly what you need to decompress from everyday life and recharge your batteries. 
74,Zoo,night_club|bar|point_of_interest|establishment, music scene that respects the musicians and its guests Very good sound  smokeless environment with good service and affordable prices.coffee & friends  music & entertainment  street & culture
75,Rainbow Metal Club,bar|point_of_interest|establishment, RAINBOW METAL CLUB Rainbow Metal Club @ Gazi - The only metal club in Athens
76,PETROpolislive,bar|point_of_interest|establishment, Freshwater Fish  Saltwater Fish  Coral  Invertebrates  Reptiles  Small Animals Feeders -  Rare Species!  We Specialize in all species from around the world.  Direct Imports and quality disease free livestock! 
77,You & Me,bar|point_of_interest|store|establishment 
78,Corner Cafe,cafe|meal_takeaway|bar|restaurant|food|point_of_interest|store|establishment 
79,Framed Salon Damaskinos George,night_club|furniture_store|home_goods_store|bar|point_of_interest|store|establishment, The handicraft manufacturing of LIVING FRAMES of GIORGOS DAMASKINOS is a company that has a tradition in the field of furniture since it has been active in the manufacture of living room frames for many years. From 2019  in the same facilities  George Damaskinos  son of Lefteris Damaskinos  started his special activity in the field of salon construction. With about 40 years of experience and an appetite for continuous development  the company can offer unparalleled quality and services to professional upholsterers and furniture manufacturing and sales stores. Contact us and we will try to meet any need of your business. 
80,MORIARTY,bar|point_of_interest|establishment, Moriarty is atmospheric  loves the British indie music scene and serves premium whiskey labels overlooking a church of Greek-Byzantine architecture.
81,KingSize Beer House,bar|restaurant|food|point_of_interest|establishment,Kingsize Beer House is the brewery that has become the most tasteful spot in New Philadelphia with 75 beer labels and great food. In the central square of New Philadelphia on the pedestrian street  you will find a warm friendly place with carefully selected beers from around the world and delicious options that accompany them uniquely. The style and atmosphere of the brewery is reminiscent of an English pub  with stone  wood and leather seats dominating the space. The menu includes beers and appetizers for all the demanding palates of beer. You can try from chicken fillets with dark beer  classic klap sandwiches  to country potatoes and everything that interests you from the wide gastronomic menu. Kingsize Beer House is open from morning with coffee and snacks until late at night with cocktails  beer and food.
82,The Party Bar,bar|point_of_interest|establishment, With a name inspired by the film of the same name of 1968  The Party Bar is a special entertainment option in night Athens and specifically in the area of ​​Psyrri. Both on Fridays and Saturdays with active DJ's to offer unique moments in 80's  90's and rock and roll rhythms  as well as on Wednesdays with live jazz jam sessions but also the rest of the week with soul  blues  rock and latin sounds  The Party manages to follow in an ideal way its well-known style until today and to offer rare musical journeys to its visitor! We are waiting for you to get to know this wonderful place  to dance until the early morning hours drinking cold beer  cool cocktails  wine and drinks from our very special wine cellar  and of course to have a great time allowing us to take care of your fun !! We are waiting for you at our Party!
83,Nargilés,cafe|bar|liquor_store|restaurant|food|point_of_interest|store|establishment, Hookah is a unique coffee shop near Burnazi Square  with a history dating back to 2001 where it serves coffee  drinks and selected delicacies. Accompanied by listening to Greek rock  art and rebetiko music  it offers an unforgettable entertainment experience.
84,Chocolat Royal,restaurant|cafe|bar|food|point_of_interest|store|establishment, Chocolat Royal  the ideal all-day option and a magnificent place for coffee  food or drinks! Situated in picture perfect Thisseio in Athens  Chocolat Royal is a beautiful four storey neoclassic building that offers a superb view from Acropolis to Mount Lycabettus. It is open every day and will surely meet all your expectations
85,Perfetta pizza trattoria,bar|restaurant|food|point_of_interest|establishment, Unique and special flavors that you should try now in a renewed space in the most beautiful and green square of Korydallos. Since 1997  we provide excellent and high quality catering services  home delivery and catering  offering something special in pizza  burgers  pasta  club sandwich  grilled  grill but also in special dishes gourmet  risotto  a variety of appetizers  such as and crepes  waffles and sweet pizzas. This tradition continues with pizzas from freshly kneaded dough that is prepared daily and is wonderfully combined with genuine cold cuts (not snack type) gouda cheese and mozarela (and not cheese substitutes) and our special secret sauce. But in the rest of our dishes we guarantee the use of fresh products  cooked with the best from the domestic market  so that you can be sure that what you eat does not stain your health and your pocket
86,Akrotiri,bar|restaurant|food|point_of_interest|establishment, While enjoying a drink or snack  you have the perfect view of beautiful beaches and the Diapontia Islands spanning the coastline. The vista from the roof terrace is truly stunning and is sure to take your breath away. Take a break from your walk or just stop to enjoy the scenery while choosing from a wide array of delicious coffees  freshly made baguettes and sandwiches  superb ice-creams and cakes. The café is well worth a visit  especially at sunset  when the horizon casts pastel shades of myriad colours  across the shimmering Ionian Sea  as you sit back and relax with a cocktail and watch nature’s lightshow at its finest. If you would like to see some of the beautiful views the Akrotiri has to offer then take a look at our photography page.
87,ΣΥΝ ΑΘΗΝΑ - SIN ATHINA,restaurant|cafe|bar|food|point_of_interest|store|establishment, Three-storey neoclassical building under the supervision of the Parthenon  early in the morning with tables outside  summer terrace overlooking the sacred rock  coffee  drinks  Mediterranean cuisine  varieties  crepes  pastries  fresh ice cream and crazy spree with unique nights by G.Sag every Friday and Saturday night on the first floor. The right place to organize any event (wedding  christening)  to invite friends  acquaintances  family  colleagues  old classmates  for birthdays  parties  meetings  reunions  for true memories. With the best service and the best prices.
88,Music Darts Club EGALITE,bar|restaurant|food|point_of_interest|establishment, It was October 1984 when George Karamousas returns to Greece equipped with the image and experience of French culture that always moved him and he had the opportunity to live in practice lately. He was always convinced that Greek culture could coexist with that of French expression and perception of life and the world. There was only one decision left  and the experiment would give the answer! So in October 1984 Egalite was born in a popular neighborhood in New Philadelphia! Nothing was accidental  neither the name nor the neighborhood  but nothing was stubbornly pursued and commercial expediency  everything was chosen as if it had to be done! of his being  because in fact he is very talented and for the reason that the real frames  sketches and paintings that adorn the space  are his own creations! But let us not omit his music education! Although she did not act as a musician  she is distinguished as a lover and collector of good music and never negotiated quality for the sake of commercialism… It is worth noting here that in her space often appear selected musicians and artists of different nationalities where they present their art  entertaining them Of course  we do not forget the darts innovation that was established in Egalite as a sport for the promotion of culture and noble rivalry  with a large participation of teams and top athletes of the genre. Today  35 years later  Egalite  passing through cyclops and concubines where the cogs of the bureaucracy forced it to migrate several times  succeeded and continues to exist thanks to the vision and the philosophy of its creator! in another neighborhood in another address  but with the same goal and many people to follow it…
89,TAR beer restaurant,bar|restaurant|food|point_of_interest|establishment, The first brewery in Greece takes its name from the Persian stringed instrument "TAR" which means string. in GREECE. Large palette of tasting for beer lovers  with a warm atmosphere of an old family house and always with art-loving trends. From the first moment it becomes the hangout for the beer lovers to enjoy an enjoyable trip to the special world of the secrets of its taste. We are waiting for you.
90,ALTO Food Bar Café,cafe|bar|food|point_of_interest|establishment,
91,Poquito Cafe-Bar,cafe|food|point_of_interest|establishment, Unpretentious  friendly and modern  Poquito is a philosophical all day cafe-bar on Ymittos in Pagrati. Unpretentious because it no longer follows the "worn" trends of industrial design and philosophical because it has a very strong paper: value for money drinks & cocktails in a casual  warm environment that you will love. In a relaxed space  reminiscent of an island or European bar In the morning  you can enjoy your coffee in the morning on its comfortable velvet stools or on the tables outside  while also making a snack for passers-by. But where Poquito excels is in the evenings. With fantastic cocktails in δό generous doses and at a price of 6.5 euros you will enjoy a drink without stopping at the ATM. We singled out his jug at 1.5l at 11 euros - the "catalyst" for an unforgettable night with your friends!
92,Στούντιο Καφέ,cafe|food|point_of_interest|establishment,
94,Balux Cafe | The House Project,cafe|food|point_of_interest|establishment, A place of unique beauty and aesthetics  designed to meet all your needs  The House Project- Balux Cafe is the ideal destination for excursions in South Athens. the opportunity to enjoy the view unobstructed. Each room has a different setup so you can enjoy it throughout the day  from morning to night. You can choose our living room and relax on our comfortable sofas or go through the library area and forget with the huge collection of books you will find available. Computers and free wi-fi can accommodate you and your partners at our x office for your next meeting. If you have an appetite for gaming  you and your company can choose from a wide range of board games  a game of billiards or still enjoy your favorite series in the playroom of House Project. Are you hungry? Try in the dining room fine dishes from the menu of Mediterranean cuisine  traditional Italian pizza made in a wood oven or enjoy our sushi menu. If you are a parent do not hesitate to visit our house  as we have taken care to entertain your children at the same time. The place includes a large playground  where your children can be busy and have fun  while you enjoy your hot chocolate with your friends or family. The kids will love it! And after such a busy day  what better way than to enjoy your drink or cocktail  listening to your favorite music. We are waiting for you every day from 9 in the morning until 3 at night  to you make you feel at home!
95,European Village,cafe|food|point_of_interest|store|establishment,
