placeId,title,tags,description
96,Coffee Island Αθηνών,cafe|food|point_of_interest|store|establishment, In 1999 in Patras it all started with the love for quality (specialty) coffee. In 2009  with the strengthening of the team  we envisioned something completely fresh  innovative and original; the creation of a new experience for quality coffee in hand. From 1999 until today  the magical journey in the world of coffee offers us special surprises. All these years the goals  the plan and the strategy have changed  but our vision and values ​​remain unchanged. We travel  Explore  Discover  Subvert  Innovate  Evolve  Serve so that the Consumer enjoys a unique Experience. Our daily promise is
97,BLACK DOG cafe,cafe|food|point_of_interest|establishment, Serving a full breakfast and lunch menu  plus specialty coffees  cakes  pastries  and more! We’re located up-island just one mile west of Vineyard Haven center – you can’t miss the vintage 1914 rail car in front of the café!Visit our island bakery  where the walls are lined with our artisan bread stacked in wooden racks and our bakery case is filled with an assortment of tasty sweet and savory treats. Early risers can start the day with our fresh-baked muffins  Woofer egg sandwich  or a bowl of our homemade granola with fresh fruit and yogurt. All paired with a cup of our locally roasted fair-trade  organic coffee. Our Café also specializes in fresh sandwiches  including lobster rolls  the turkey club  classic BLT  and more  all made on our delicious Black Dog bread. If you’re seeking lighter fare  check out our variety of salad options. Traveling up island or spending a day picnicking on the beach? Grab a few sandwiches (and maybe even a world-renowned Black Dog cookie or two!)  and you’re set for the perfect lunch on the go.No trip to the island would be complete without sampling our famous  homemade-from-scratch pastries  desserts  cookies  and pies. Indulge in our decadent Mousse Bomb  Blackout Cake  Lemon Squares  and more. Our Pastry Chefs have been known to surprise us with their daily dessert specials so a trip to the bakery case is always a treat. 
98,Enzzo De Cuba,cafe|restaurant|food|point_of_interest|establishment, ENZZO CLUB could be characterized as an all time classic  since since 1997 it has been a constant meeting point of clubbers in West Attica and beyond. Live atmosphere  explosive cocktails and mood that stays in the "red" all night until the early morning hours. A special place hosts you from early in the morning for espresso and Greek coffee on embers  in the afternoon for sweets and snacks  and until late night out for fun.ENZZO DE CUBAHave you ever imagined that a trip to exotic Cuba could take as little as an evening stroll in Burnazi? This is exactly the case with Enzzo de Cuba. The Enzzo de Cuba is a place of ideology. Havana Vieja  the historical center of the Cuban capital  a country with special people and a unique culture  was a source of inspiration. The palm trees rising in the center of the cobbled square  the mojito metropolis  La Bodeguida del Medio and the Partagas cigar factory are some of the scenes of Enzzo de Cuba that will evoke sweet memories for those who have traveled to Cuba but also an unexpected one. to those who have not been to know it. ENZZO UPSTAIRSEnzzo Upstairs  a space with strong decorative elements in white and wenge colors  is more like a lobby of a luxury hotel than a coffee bar. An area ideal for a relaxing drink or a special cocktail  without time restrictions  allows the visitor to enjoy the starry sky on summer nights and the view of the whole square in winter.
99,Linard Ltd,cafe|food|point_of_interest|establishment, Our mission is to import superior quality instant coffee through intensive research and search  to create and then to offer in the Greek and global market unique delicious coffee profiles  thanks to the know-how and the long experience of the company in the field of production.   seeking to exceed customer expectations
100,Delish Bakeshop,bakery|cafe|food|point_of_interest|store|establishment, In Kolonaki you will find the Delish Bakeshop  where cupcakes  coffee  pastries  cakes and puff pastry are waiting for you at the best prices. On the right you can see our menu!
101,Attalos,cafe|food|point_of_interest|establishment, Cafe - Bar - Restaurant Wedding Halls Baptism Social events Kids party
102,Niki Apollonion S.A.,cafe|food|point_of_interest|establishment, After enjoying Hellenic Parliament  go to this cafe that is not far away. Greek cuisine is what Niki Apollonion S. A. boasts. It's nice to order great coffee. Guests do not highly appreciate sandwiches at this place.It's always a pleasure to rest and have a meal here because of the spectacular service. This spot provides food at attractive prices. This cafe is rated on Google 4 by its clients. 
103,Harmony Mountain Tea,cafe|food|point_of_interest|establishment, Mountain Tea Company founded in 2000  produces-cultivates  packages and distributes-exports Greek Mountain Tea to Europe  Asia  America and Australia. We own and manage every phase of the production of our tea.Starting by placing seed into the soil at a predetermined depth  being also present at the seedling stage we harvest our plants  we package our tea  and we distribute it to our customers around the world. Managing the whole process from inception to delivery  Mountain Tea Company warranties the quality of our product.Although our headquarters are located in Athens  company’s warehouse and the mountain tea areas are located in Greece  on the Greek mountain called “Othrys” (County of Magnesia). Our mission is to bring the flavors of Greece all around the world! Aims and ObjectivesOur current short-term goal is to further promote our product to tea fans  potential customers and investors  which will support our long-term goal of making " Mountain Tea Company " a leading brand in the international tea market. In order to attract people from all over the world to taste our products  we have developed a well-organized online store contracting at the same time international wholesalers as well as tea shop chains.Company’s long-term objective is also to develop our own retail boutiques offering to our customers apart from a high quality product a unique shopping experience as well. Our PhilosophyMountain’s Tea Company mission is to bring our customers closer to what matters to them the most: “nature”  and familiarize consumers with a healthier way of life.Our interest is not only to help people develop healthy diet habits  but also to inspire awareness and gratitude for the environment -what we call “mother nature”- and further develop peoples’ environmental concerns and interests with respect to environmental health issues.Furthermore  company’s long term goal is to develop in-depth brand knowledge establishing our business identity and creating brand recognition among consumers and against the most renowned and thus respectful competitors in the bio-food industry.
104,BLUE MONKEY,restaurant|meal_delivery|meal_takeaway|cafe|food|point_of_interest|store|establishment, Our love for quality  delicious and healthy food  became a decision for action and so we created the Blue Monkey. For all of us who live and work in the city  to be able to enjoy special flavors. Every day we try to offer "The most sought after menu in the city for a light  nutritious & balanced meal". We choose the best ingredients  create original recipes and offer you variety and quality with home care. Very fresh fruits and vegetables that we receive every morning. Selected cold cuts and cheeses that are cut at the moment we prepare our products. Fresh meats and chickens from branded farms. Fresh juicy burgers  fermented exclusively for you. Our day starts very early to offer you the ideal start for your office with freshly ground fragrant coffee  freshly squeezed natural juices  homemade cakes  French croissants with homemade jam and hot jam. 
105,Artiston,bakery|cafe|food|point_of_interest|store|establishment, Bakery  confectionery that he has been creating since 1910. Tradition and innovation marry and create delicious delicacies. 
106,Φαν Γεύσεις,cafe|food|point_of_interest|store|establishment, Where tradition meets evolution  21  years the best coffee in town
107,Skordópistē,restaurant|cafe|food|point_of_interest|store|establishment 
108,Flisvos Cinema (Open Air),movie_theater|cafe|food|point_of_interest|establishment, The best summer cinema of the southern suburbs  with perfect technological means that create excellent projection conditions
109,Gregóris,cafe|restaurant|food|point_of_interest|store|establishment, Grigoris stores invite the consumer to an exciting experience of snacks and coffee! The wide variety of fresh  tasty and special proposals  are the most delicious break of the day! For anyone ... thirsty for even more our trained baristas  are willing to The friendly atmosphere  the smile  the cleanliness are points of excellence of a truly successful franchise chain that has conquered the hearts of hundreds of thousands of Greeks! 
111,Maiandros restaurant,cafe|restaurant|food|point_of_interest|establishment, From early in the morning we are waiting for you to drink your coffee accompanying it with one of our homemade-traditional sweets.Later you can choose between our delicious varieties our daily cooked meals and the wide range of main and side dishes made with homemade recipes and ingredients that are distinguished for their purity and quality.So in the heart of Athens and just behind the ISAP-METRO station in Monastiraki there is the "STATION" of taste enjoyment and quality.
112,Flocafe,cafe|food|point_of_interest|establishment, In 1994  the first Flocafé shop opened its doors to the Greek public  introducing and eventually establishing a new era of taste and quality. Over this 20-year successful course  Flocafé has been a leader in the Food service sector of mass catering with more than 90 shops. The company developed and evolved through continuous training and group work  this way building a long-lasting relationship with consumers. Our endless energy  our particular passion for coffee and the continuous search for optimized services and products has taken us to the next level - the FLOCAFE Espresso Room. The goal of this new concept is to upgrade the customer experience in a new ambience where everything – the people  the products  the aromas  the music – become one in order to form the perfect blend  every single moment.
113,sensei cafe,cafe|food|point_of_interest|establishment, This page is for the various events that will take place on weekends in the cafe. The events will be addressed mainly to the otaku community. This page is for the various events that will take place on weekends in the cafe. The events will be addressed mainly to the otaku community. In case anyone is interested they can close the store for their own use. The store on weekends will operate with anime air and will slowly have the appropriate decoration.
114,Point Cafe Athens,cafe|food|point_of_interest|establishment, Coffees from fine blends  drinks  handmade sweets  Greek wines  drinks  accompanied by original cold and hot dishes. 
115,Spiaggia,cafe|food|point_of_interest|establishment, Coffees of all kinds Freshly squeezed & Natural Juices Various Drinks Variety of sandwiches  puff pastry & sweetsCustom menu
116,BARBERA CAFFE Greece est 2006,cafe|food|point_of_interest|establishment, NaN
117,Στοά Cafe,cafe|restaurant|food|point_of_interest|store|establishment, coffee bar cafe bar
118,Kaissa Cafe,cafe|food|point_of_interest|store|establishment, Kaissa Cafe is a new colorful multipurpose space by the company Kaissa with good coffee  music  free internet  food and of course Kaissa table. We are waiting for you!
119,CENTRALE CAFE,cafe|restaurant|food|point_of_interest|establishment, All day cafe-resto-bar. Good quality coffee  brunch  fresh snacks and healthy lunch and dinner options. Centrale is located in the heart of Athens  giving you the opportunity to relax and enjoy the vivid city-center. You can grab your coffee to go  or you can sit in order to enjoy our homemade desserts  sandwiches  fresh pasta and vegetarian options. Try our signature cocktails or enjoy a glass of wine or a cold beer
120,Senso Cafe,cafe|restaurant|food|point_of_interest|establishment, Coffee  chocolate flavors  hot tea and a variety of drinks by the souds of soft music
121,Athinaikon,cafe|restaurant|food|point_of_interest|store|establishment, Your Athinaikon restaurant welcomes the two central parts of the city. The traditional tavern on the pedestrian street of Themistokleous 2 and the new taste and art haunt Mitropoleos 34 intend to impress their friends with the environment  wide range of dishes and their prices. The extensive menu  which stand out the traditional meat dishes  the recipes with the highest quality seafood and fresh fish  fresh salads  supplemented by a variety of appetizers and topped with sweet suggestions of the chef. The dishes are accompanied by a list of fine wines for all tastes. Greek and Mediterranean cuisine at its best.
122,Palazzo Cafe,cafe|meal_delivery|meal_takeaway|restaurant|food|point_of_interest|store|establishment, With over 20 years of experience in the field of catering  palazzo delivery offers you a unique variety of coffee and exquisite flavors in your area!
123,Leonida's cafe,cafe|food|point_of_interest|establishment, Start your day with Leonidas passion coffee Leonidas passion coffee Passion for good coffee Passion for a nice breakfast Leonidas passion coffee  passion for quality Leonidas and at your place  with a phone call Leonidas passion caffee  Makedonias & Themistokleous 62  in Kalamata This is how your day starts more beautifully
124,Cafe - Bar Mosquito,cafe|food|point_of_interest|establishment, Beautiful yard for the summer  warm space inside  with wonderful decor and atmosphere  draft BAP beer  Stratos and Angeliki unique forms  a hangout for good rock in Nea Smyrni and surrounding areas. The place to be!
125,GREGORY MIKROGEVMATA,cafe|restaurant|food|point_of_interest|establishment, Every day  I prepare the highest quality products  with the highest hygiene standards  applying preventive HACCP self-control measures that ensure food safety Today  on World Food Safety Day  I renew my commitment!
126,yassou cafe,cafe|food|point_of_interest|establishment,NaN
127,Moreno,cafe|food|point_of_interest|store|establishment, we decided to change the profile of our business and so we opened our doors to the public as a modern cafe. We have enriched our menu with sweets  drinks  beers  wines and delicious snacks  which we continue to offer you until today. At Moreno Cafe  we know how precious the moments you choose to drink a coffee or eat something outside the house are for you  so we emphasize every detail. We choose the best varieties of coffee and we carefully choose the raw materials with which we prepare everything you will find in our catalog.
128,Yard Bistrot and Bar Athens,restaurant|meal_takeaway|cafe|food|point_of_interest|store|establishment, Whether you are going to have lunch  dinner or just a drink  the Yard will always meet your needs. We cordially invite you to our restaurant  which is located at Makrygianni street  right in front of the Acropolis museum & Acropolis metro station. Relax at our patio or interior & enjoy delicious food with good wine. We mainly serve greek cuisine with a modern touch & add variety to our menu according to the season
